{
  "$schema": "../schemas/audio.schema.json",
  "schemaVersion": 1,
  "music": {
    "underground": { "file": "underground.ogg" }
  },
  "playlists": {
    "home_lattice": ["underground"]
  },
  "sounds": {
    "jump": { "zzfx": [0.3,0.02,170,0.01,0.02,0.09,1,1,5,0,0,0,0,0,0,0,0,0.7,0.03,0,-2500] },
    "airjump": { "zzfx": [0.3,0.02,240,0.01,0.02,0.1,1,1,5,0,60,0.04,0,0,0,0,0,0.7,0.03,0,-2500] },
    "land": { "zzfx": [0.35,0.03,110,0.005,0.01,0.1,0,1,-6,0,0,0,0,0,0,0,0,0.6,0.02] },
    "push": { "zzfx": [0.22,0.05,350,0.05,0.06,0.2,4,1,8,0,0,0,0,0,0,0,0,0.6,0.04,0,-1200] },
    "plug": { "zzfx": [0.5,0.03,200,0.005,0.03,0.18,0,1,-8,0,0,0,0,0,0,0,0,0.7,0.03] },
    "bounce": { "zzfx": [0.7,0.05,260,0.01,0.05,0.25,0,1.2,25,0,0,0,0,0,0,0,0,0.8,0.05] },
    "shake": { "zzfx": [0.2,0.05,200,0.01,0.05,0.08,1,1,0,0,0,0,0.03,0,0,0,0,0.6,0.02,0.6] },
    "collapse": { "zzfx": [0.5,0.05,260,0,0.02,0.15,0,1,50,0,200,0.04,0.06,0,0,0,0,0.8,0.03,0.6] },
    "regrow": { "zzfx": [0.5,0.05,3200,0.12,0.01,0.01,0,1,-60,0,0,0,0,0,0,0,0,0.8,0.02] },
    "die": { "zzfx": [0.8,0.03,300,0,0.02,0.4,0,1,50,0,250,0.05,0.07,0,0,0,0,0.8,0.05,0.8] },
    "die:void": { "zzfx": [0.8,0.03,450,0,0.05,0.6,0,1,-15,0,-100,0.08,0.06,0,0,0,0,0.8,0.05,0.8] },
    "respawn": { "zzfx": [0.8,0.03,2300,0.4,0.02,0.01,0,1,-50,0,-250,0.05,0.07,0,0,0,0,0.8,0.05,0.8] },
    "crash": { "zzfx": [0.9,0.03,250,0,0.05,0.8,0,1,40,0,-120,0.06,0.09,0,0,0,0,0.8,0.08,0.8] },
    "pop": { "zzfx": [0.55,0.05,260,0,0.01,0.09,0,1,40,0,0,0,0,0,0,0,0,0.8,0.02] },
    "hit": { "zzfx": [0.35,0.05,190,0,0.01,0.07,0,1,15,0,0,0,0,0,0,0,0,0.8,0.02] },
    "break": { "zzfx": [0.65,0.05,300,0,0.01,0.1,0,1,60,0,200,0.03,0,0,0,0,0,0.8,0.02] },
    "armor": { "zzfx": [0.3,0.05,520,0,0.01,0.1,1,2,0,0,0,0,0,0,0,0,0,0.8,0.08,0,-2500] },
    "block": { "zzfx": [0.3,0.03,650,0,0.01,0.08,0,1,-8,0,0,0,0,0,0,0,0,0.8,0.03] },
    "reflect": { "zzfx": [0.3,0.03,800,0,0.01,0.1,0,1,15,0,0,0,0,0,0,0,0,0.8,0.03] },
    "ricochet": { "zzfx": [0.25,0.03,800,0,0.01,0.08,0,1,-15,0,0,0,0,0,0,0,0,0.8,0.03] },
    "cast:zap": { "zzfx": [0.55,0.02,1300,0,0.02,0.15,0,1,-60,0,0,0,0,0,5,0,0,0.8,0.03] },
    "cast:shield": { "zzfx": [0.45,0.02,380,0.02,0.1,0.3,0,1,10,0,0,0,0,0,4,0,0,0.7,0.1] },
    "cast:firewall": { "zzfx": [0.5,0.02,300,0.02,0.12,0.3,0,1,14,0,0,0,0,0,6,0,0,0.7,0.1] },
    "cast:pause": { "zzfx": [0.5,0.02,900,0,0.04,0.25,0,1,-30,0,0,0,0,0,4,0,0,0.7,0.1] },
    "deny": { "zzfx": [0.6,0.05,130,0,0.05,0.12,2,1,0,0,0,0,0.05,0,0,0,0,0.8,0.05] },
    "fizzle": { "zzfx": [0.6,0.1,200,0,0.03,0.15,4,1,-8,0,0,0,0,1,0,0,0,0.6,0.05,0,900] },
    "spell": { "zzfx": [0.5,0.05,600,0,0.01,0.06,1,1,0,0,200,0.02,0,0,0,0,0,0.8,0.05] },
    "warp:blink": { "zzfx": [0.5,0.02,500,0.01,0.1,0.03,0,1,40,-570,0,0,0,0,0,0,0,0.8,0.02] },
    "warp:warp": { "zzfx": [0.55,0.02,400,0.02,0.24,0.04,0,1,30,-200,0,0,0,0,0,0,0,0.8,0.05] },
    "cut": { "zzfx": [0.7,0.05,900,0,0.03,0.12,1,1.5,-20,0,0,0,0,0,0,0,0,0.7,0.05] },
    "paste": { "zzfx": [0.6,0.03,3800,0.09,0.005,0.005,0,1,-70,0,0,0,0,0,0,0,0,0.8,0.01] },
    "pull": { "zzfx": [0.25,0.05,300,0.03,0.08,0.22,4,1,-8,0,0,0,0,0,0,0,0,0.6,0.04,0,-1200] },
    "compile": { "zzfx": [0.65,0.03,3800,0.09,0.005,0.005,0,1,-70,0,0,0,0,0,0,0,0,0.8,0.01] },
    "fork": { "zzfx": [0.55,0.03,3800,0.09,0.005,0.005,0,1,-70,0,0,0,0.05,0,0,0,0,0.8,0.01,0.5] },
    "expire": { "zzfx": [0.4,0.05,500,0,0.03,0.15,1,1,-10,0,0,0,0,0,0,0,0,0.7,0.05] },
    "scan": { "zzfx": [0.6,0.05,200,0.1,0.1,0.4,0,1,12,0,0,0,0,0,0,0,0,0.7,0.1] },
    "reveal": { "zzfx": [0.7,0.05,1100,0,0.03,0.25,0,1.2,0,0,300,0.04,0,0,0,0,0,0.8,0.1] },
    "freeze": { "zzfx": [0.3,0.05,700,0,0.03,0.2,0,1,-4,0,0,0,0.05,0,0,0,0,0.7,0.1,0.5] },
    "thaw": { "zzfx": [0.25,0.05,500,0,0.02,0.12,0,1,5,0,0,0,0,0,0,0,0,0.7,0.1] },
    "pickup": { "zzfx": [1,0.05,880,0.01,0.06,0.2,0,1.2,0,0,440,0.06] },
    "pickup:refill": { "zzfx": [0.8,0.05,660,0.01,0.05,0.18,0,1.2,0,0,330,0.05] },
    "pickup:boost": { "zzfx": [0.8,0.05,880,0.01,0.06,0.2,0,1.4,0,0,440,0.06] },
    "pickup:disk": { "zzfx": [1,0.02,440,0.01,0.2,0.5,0,1,6,0,220,0.1,0.12,0,0,0,0,0.8,0.1] },
    "pickup:upgrade": { "zzfx": [1,0.02,520,0.01,0.2,0.5,0,1,6,0,260,0.1,0.1,0,0,0,0,0.8,0.1] },
    "pickup:buff": { "zzfx": [1,0.02,600,0.01,0.15,0.4,0,1,4,0,300,0.08,0.1,0,0,0,0,0.8,0.1] },
    "pickup:fragment": { "zzfx": [1,0.02,700,0.01,0.3,0.7,0,1,5,0,350,0.12,0.09,0,0,0,0,0.8,0.15] },
    "pickup:secret": { "zzfx": [1,0.02,900,0.01,0.3,0.7,0,1,3,0,450,0.1,0.08,0,0,0,0.05,0.8,0.15] },
    "pickup:access": { "zzfx": [1,0.02,500,0.01,0.2,0.5,0,1,6,0,250,0.1,0.1,0,0,0,0,0.8,0.1] },
    "drop": { "zzfx": [0.9,0.05,300,0.01,0.15,0.4,0,1,10,0,150,0.08,0,0,0,0,0,0.8,0.1] },
    "shrine": { "zzfx": [0.9,0.02,520,0.05,0.3,0.6,0,1,2,0,260,0.15,0,0,0,0,0.1,0.8,0.15] },
    "read": { "zzfx": [0.3,0.05,1400,0,0.01,0.03,1,1,0,0,0,0,0.03,0,0,0,0,0.7,0.02] },
    "access": { "zzfx": [1,0.02,400,0.02,0.3,0.8,0,1,4,0,400,0.15,0.1,0,0,0,0.1,0.8,0.15] },
    "win": { "zzfx": [1,0.02,330,0.05,0.5,1.2,0,1,3,0,330,0.2,0.15,0,0,0,0.1,0.8,0.2] },
    "switch": { "zzfx": [0.6,0.05,500,0,0.02,0.1,1,1.5,0,0,120,0.02,0,0,0,0,0,0.8,0.05] },
    "tick": { "zzfx": [0.25,0,1600,0,0.005,0.02,1,1,0,0,0,0,0,0,0,0,0,0.7,0.01] },
    "gate": { "zzfx": [0.35,0,300,0.01,0.05,0.12,1,1,0,0,150,0.05,0,0,0,0.1,0,0.8,0.04] },
    "unlock": { "zzfx": [0.4,0,450,0,0.03,0.08,1,1,0,0,200,0.07,0,0,0,0.15,0,0.8,0.03] },
    "lock": { "zzfx": [0.4,0,650,0,0.03,0.08,1,1,0,0,-200,0.07,0,0,0,0.15,0,0.8,0.03] },
    "exit": { "zzfx": [0.2,0,300,0,0.01,0.07,1,1,0,0,0,0,0,0,0,0,0,0.7,0.02,0,-1500] },
    "discharge": { "zzfx": [0.4,0.02,450,0,0.03,0.18,0,1,-25,0,0,0,0,0,3,0,0,0.8,0.04] },
    "phase": { "zzfx": [1,0.05,120,0.02,0.3,0.6,2,1.5,5,0,0,0,0,0.6,0,0.3,0,0.8,0.1] },
    "teleport": { "zzfx": [0.35,0.02,300,0.02,0.1,0.04,0,1,20,-150,0,0,0,0,0,0,0,0.8,0.05] },
    "exposed": { "zzfx": [0.3,0.05,300,0,0.05,0.2,1,1,5,0,0,0,0,0,0,0,0,0.8,0.1,0,-2500] },
    "armored": { "zzfx": [0.3,0.05,250,0,0.05,0.2,1,1,-5,0,0,0,0,0,0,0,0,0.8,0.1,0,-2500] },
    "ui_move": { "zzfx": [0.3,0,700,0,0.01,0.03,1,1,0,0,0,0,0,0,0,0,0,0.7,0.02] },
    "ui_open": { "zzfx": [0.4,0,500,0,0.02,0.08,1,1,8,0,0,0,0,0,0,0,0,0.7,0.05] },
    "ui_back": { "zzfx": [0.4,0,500,0,0.02,0.08,1,1,-8,0,0,0,0,0,0,0,0,0.7,0.05] },
    "ui_choose": { "zzfx": [0.5,0,800,0,0.02,0.1,1,1,0,0,400,0.04,0,0,0,0,0,0.8,0.05] },
    "ui_adjust": { "zzfx": [0.3,0,900,0,0.01,0.04,1,1,0,0,0,0,0,0,0,0,0,0.7,0.02] },
    "ui_deny": { "zzfx": [0.5,0,130,0,0.04,0.1,2,1,0,0,0,0,0.04,0,0,0,0,0.8,0.05] },
    "hum_shield": { "zzfx": [0.22,0,110,0,0.4998,0,2,1,0,0,0,0,0.125,0,3,0,0,1,0,0.25,-900], "loop": true },
    "hum_firewall": { "zzfx": [0.25,0,80,0,0.4998,0,2,1,0,0,0,0,0.0625,0.03,0,0,0,1,0,0.4,-1000], "loop": true },
    "discharge:burst": { "zzfx": [0.7,0.1,150,0,0.04,0.35,2,2,-3,0,0,0,0.02,0.5,30,0,0,0.8,0.08,0.6,-1800] },
    "discharge:arc": { "zzfx": [0.65,0.1,260,0,0.05,0.3,2,2,-5,0,0,0,0.015,0.4,40,0,0,0.8,0.08,0.6,-2500] },
    "discharge:bolt": { "zzfx": [0.6,0.1,1000,0,0.03,0.4,2,2,-4,0,0,0,0.012,0.35,60,0,0,0.8,0.1,0.7,-3500] }
  }
}
